{
  "version": 1,
  "kind": "implementation_plan",
  "handoff_id": "2026-04-16T183200Z-0002",
  "parent_handoff_id": "2026-04-16T183200Z-0001",
  "from_agent": "planner",
  "to_agent": "writer",
  "created_at": "2026-04-16T18:40:00Z",
  "status": "pending",
  "payload": {
    "goal": "Implement the three workflow improvements by updating orchestrator prompts",
    "why": "Current system has unclear handover flow, hidden JSON for users, and orchestrator ignores AGENT.md prerequisites",
    "files_to_modify": [
      "prompts/coding-boss.txt",
      "prompts/docs.txt"
    ],
    "files_to_inspect_only": [
      ".opencode/schemas/handoff.schema.json",
      ".opencode/schemas/result.schema.json",
      "opencode.json"
    ],
    "do_not_modify": [],
    "inputs_already_verified": [
      "Implementation plan in result file",
      "Current prompt structure in opencode.json"
    ],
    "changes": [
      "Add Handoff Writer section: writes JSON to .opencode/sessions/<session_id>/handoffs/<seq>.json",
      "Add Self-Service Delegation: pass only file path to subagent",
      "Add Summary Generator: 2-3 sentence summary for user display",
      "Add Status Update Hook: phase transitions (routing, planning, execution, review, recording)",
      "Add AGENT.md Parser: find '## Prerequisites' section, execute bash code blocks",
      "Add Prerequisite Enforcement: execute prerequisites BEFORE delegating"
    ],
    "tests": [
      "Verify handoff JSON written correctly",
      "Verify subagent receives file path",
      "Verify summary visible to user",
      "Verify prerequisites executed"
    ],
    "done_when": [
      "Both orchestrator prompts updated with all sections",
      "Ready for testing"
    ],
    "abort_if": [],
    "architecture_decisions": [
      "File-path self-service model",
      "AGENT.md as source of truth",
      "Summary-first UX"
    ],
    "target_symbols_or_sections": [],
    "execution_order": [
      "Update prompts/coding-boss.txt",
      "Update prompts/docs.txt"
    ],
    "interfaces_or_contracts_affected": [],
    "edge_cases_or_failure_paths": [
      "AGENT.md missing: fallback to no prerequisites",
      "Worktree already exists: skip or warn"
    ],
    "out_of_scope": [
      "Schema changes",
      "CLI status commands"
    ],
    "verification_expectations": [],
    "examples": [
      "Handoff Writer: 'Write to .opencode/sessions/{id}/handoffs/0001.json...'",
      "Delegation: 'Read handoff from .opencode/sessions/.../0001.json'",
      "AGENT.md Prerequisites: '## Prerequisites\n```bash\ngit worktree add -b feature/123 ../feature-123\n```'"
    ],
    "review_focus": [],
    "known_risks_or_limitations": [
      "AGENT.md format must be standardized",
      "Status updates depend on prompt compliance"
    ]
  }
}
