{
  "version": 1,
  "kind": "review_summary",
  "handoff_id": "2026-04-16T183200Z-0004",
  "parent_handoff_id": "2026-04-16T183200Z-0003",
  "from_agent": "orchestrator",
  "to_agent": "reviewer",
  "created_at": "2026-04-16T19:00:00Z",
  "status": "pending",
  "payload": {
    "goal": "Review the workflow clarification for result artifact writing",
    "why": "Clarified that orchestrator writes result artifacts, subagents return structured output",
    "files_to_modify": [],
    "files_to_inspect_only": [
      "prompts/coding-boss.txt",
      "prompts/docs.txt"
    ],
    "do_not_modify": [],
    "inputs_already_verified": [],
    "changes": [
      "Added: 'subagents (including reviewers) return structured output; you write the result artifact to .opencode/sessions/<session_id>/results/'"
    ],
    "tests": [],
    "done_when": [
      "Review complete"
    ],
    "abort_if": [],
    "architecture_decisions": [
      "Option D: Hybrid - subagent returns structured output, orchestrator writes artifact"
    ],
    "target_symbols_or_sections": [],
    "execution_order": [],
    "interfaces_or_contracts_affected": [],
    "edge_cases_or_failure_paths": [],
    "out_of_scope": [],
    "verification_expectations": [],
    "examples": [],
    "review_focus": [
      "Is the clarification clear?",
      "Any edge cases to consider?"
    ],
    "known_risks_or_limitations": []
  }
}
