{
  "version": 1,
  "kind": "review_summary",
  "handoff_id": "2026-04-16T183200Z-0003",
  "parent_handoff_id": "2026-04-16T183200Z-0002",
  "from_agent": "writer",
  "to_agent": "reviewer",
  "created_at": "2026-04-16T18:55:00Z",
  "status": "pending",
  "payload": {
    "goal": "Review the workflow improvements made to orchestrator prompts",
    "why": "Verify the changes are correct, complete, and don't introduce issues",
    "files_to_modify": [],
    "files_to_inspect_only": [
      "prompts/coding-boss.txt",
      "prompts/docs.txt"
    ],
    "do_not_modify": [],
    "inputs_already_verified": [],
    "changes": [
      "Added self-service model: subagent reads JSON file from path",
      "Added summary generation: 2-3 sentence summary before delegation",
      "Removed AGENT.md parsing section (was creating unwanted coupling)"
    ],
    "tests": [],
    "done_when": [
      "Review complete with approval or feedback"
    ],
    "abort_if": [],
    "architecture_decisions": [
      "File-path self-service model: subagent reads JSON, not inline",
      "AGENT.md as black box: agent software loads it, orchestrator doesn't parse",
      "Summary-first UX: user sees summary, JSON hidden for audit"
    ],
    "target_symbols_or_sections": [],
    "execution_order": [],
    "interfaces_or_contracts_affected": [],
    "edge_cases_or_failure_paths": [],
    "out_of_scope": [],
    "verification_expectations": [],
    "examples": [],
    "review_focus": [
      "Are the workflow contract changes correct?",
      "Is the summary generation appropriate?",
      "Any issues with the self-service model?"
    ],
    "known_risks_or_limitations": []
  }
}
